[
    {
      "Date": "2024-01-20",
      "Theme": "Reflecting on Creation",
      "Scripture": "Genesis 1:1-13",
      "Devotion": "Today, ponder the majestic account of God's creation. Consider the power and intentionality with which God brought forth light, separated the waters, and formed the foundations of the earth. As you read, marvel at the Creator's design and order in the universe.",
      "PrayerPrompt": "Pray for a renewed appreciation of God's creative power in your life.",
      "ImageDescription": "An image depicting the beauty of the created world, with vibrant landscapes, oceans, and celestial bodies.",
      "OptionalPassages": ["Psalm 104", "Proverbs 3:19-20"],
      "Quotation": {
        "Quote": "In the beginning, God created the heavens and the earth.",
        "Author": "Genesis 1:1",
        "Link": "https://www.biblegateway.com/passage/?search=Genesis+1:1"
      }
    },
    {
      "Date": "2024-01-21",
      "Theme": "Embracing God's Sovereignty",
      "Scripture": "Genesis 1:14-31",
      "Devotion": "Dive into the narrative of God's creation of the sun, moon, stars, animals, and humans. Acknowledge God's sovereignty over all of creation. Take time to appreciate the intricate details in each creature and express gratitude for being part of God's grand design.",
      "PrayerPrompt": "Pray for a deeper understanding of God's sovereignty in your daily life.",
      "ImageDescription": "An image symbolizing God's sovereignty, perhaps featuring a majestic night sky filled with stars.",
      "OptionalPassages": ["Psalm 19:1-6", "Proverbs 8:22-31"],
      "Quotation": {
        "Quote": "The heavens declare the glory of God; the skies proclaim the work of his hands.",
        "Author": "Psalm 19:1",
        "Link": "https://www.biblegateway.com/passage/?search=Psalm+19:1"
      }
    },
    {
      "Date": "2024-01-22",
      "Theme": "Turning to God in Repentance",
      "Scripture": "Genesis 3:1-13",
      "Devotion": "Contemplate the tragic events of the fall in Genesis 3. Consider how disobedience and temptation led to a broken relationship with God. Use this day for personal reflection and repentance. Recognize the need for dependence on God, seeking His forgiveness and restoration.",
      "PrayerPrompt": "Pray for the strength to resist temptation and for forgiveness in areas where you've fallen short.",
      "ImageDescription": "A reflective image symbolizing repentance, such as a person kneeling in prayer or a broken chain mended by divine grace.",
      "OptionalPassages": ["Proverbs 28:13", "James 4:7-10"],
      "Quotation": {
        "Quote": "And they heard the sound of the LORD God walking in the garden in the cool of the day, and the man and his wife hid themselves from the presence of the LORD God among the trees of the garden.",
        "Author": "Genesis 3:8",
        "Link": "https://www.biblegateway.com/passage/?search=Genesis+3:8"
      }
    },
    {
      "Date": "2024-01-23",
      "Theme": "Celebrating Unity in Marriage",
      "Scripture": "Genesis 2:18-25",
      "Devotion": "Explore the creation of Eve and the establishment of marriage. Reflect on the beauty of companionship and unity in relationships. Take time to appreciate the God-given institution of marriage and seek to honor and cherish those close to you.",
      "PrayerPrompt": "Pray for strong and healthy relationships in your life.",
      "ImageDescription": "An image capturing the essence of unity in marriage, perhaps featuring a couple holding hands or embracing.",
      "OptionalPassages": ["Proverbs 18:22", "Ephesians 5:22-33"],
      "Quotation": {
        "Quote": "Therefore a man shall leave his father and his mother and hold fast to his wife, and they shall become one flesh.",
        "Author": "Genesis 2:24",
        "Link": "https://www.biblegateway.com/passage/?search=Genesis+2:24"
      }
    },
    {
      "Date": "2024-01-24",
      "Theme": "Trusting God's Promises",
      "Scripture": "Genesis 3:14-24",
      "Devotion": "Examine the consequences of sin and God's response in Genesis 3:14-24. Reflect on the promise of a Savior and God's continued care for humanity despite the fall. Consider the importance of trusting in God's promises even in the midst of challenges.",
      "PrayerPrompt": "Pray for trust and faith in God's promises, especially during difficult times.",
      "ImageDescription": "An image representing God's promise, such as a rainbow or a symbolic depiction of redemption.",
      "OptionalPassages": ["Proverbs 3:5-6", "Isaiah 41:10"],
      "Quotation": {
        "Quote": "The LORD God said to the serpent, 'I will put enmity between you and the woman, and between your offspring and her offspring; he shall bruise your head, and you shall bruise his heel.'",
        "Author": "Genesis 3:15",
        "Link": "https://www.biblegateway.com/passage/?search=Genesis+3:15"
      }
    }
  ]
  